{
  "$schema": "http://json-schema.org/draft-07/schema#",
  "type": "object",
  "title": "TemplateRendererConfig",
  "description": "A fill-in-the-blanks template with copy-to-clipboard",
  "required": [
    "title",
    "fields",
    "template"
  ],
  "properties": {
    "title": {
      "type": "string"
    },
    "fields": {
      "type": "array",
      "items": {
        "type": "object",
        "required": [
          "name",
          "label",
          "placeholder"
        ],
        "properties": {
          "name": {
            "type": "string"
          },
          "label": {
            "type": "string"
          },
          "placeholder": {
            "type": "string"
          },
          "type": {
            "type": "string",
            "enum": [
              "text",
              "textarea",
              "select"
            ]
          },
          "options": {
            "type": "array",
            "items": {
              "type": "string"
            }
          }
        }
      }
    },
    "template": {
      "type": "string",
      "description": "Template text with {{fieldName}} placeholders"
    },
    "copyButton": {
      "type": "boolean"
    },
    "appearance": {
      "type": "object",
      "description": "Visual polish: entrance animation, dark mode colors, responsive breakpoints",
      "properties": {
        "animation": {
          "type": "object",
          "properties": {
            "entrance": {
              "type": "string",
              "enum": [
                "none",
                "fade",
                "slide",
                "scale"
              ],
              "default": "none"
            },
            "duration": {
              "type": "number",
              "default": 300
            },
            "delay": {
              "type": "number",
              "default": 0
            }
          }
        },
        "darkMode": {
          "type": "object",
          "properties": {
            "background": {
              "type": "string"
            },
            "surface": {
              "type": "string"
            },
            "text": {
              "type": "string"
            },
            "textSecondary": {
              "type": "string"
            },
            "accent": {
              "type": "string"
            },
            "border": {
              "type": "string"
            }
          }
        },
        "responsive": {
          "type": "object",
          "properties": {
            "padding": {
              "type": "object",
              "properties": {
                "mobile": {
                  "type": "string"
                },
                "tablet": {
                  "type": "string"
                },
                "desktop": {
                  "type": "string"
                }
              }
            },
            "maxWidth": {
              "type": "object",
              "properties": {
                "mobile": {
                  "type": "string"
                },
                "tablet": {
                  "type": "string"
                },
                "desktop": {
                  "type": "string"
                }
              }
            },
            "fontSize": {
              "type": "object",
              "properties": {
                "mobile": {
                  "type": "number"
                },
                "tablet": {
                  "type": "number"
                },
                "desktop": {
                  "type": "number"
                }
              }
            }
          }
        }
      }
    }
  }
}
